{
  "$schema": "https://json-schema.org/draft/2020-12/schema",
  "additionalProperties": false,
  "properties": {
    "commands": {
      "items": {
        "type": "object"
      },
      "type": "array"
    },
    "lifecycle": {
      "items": {
        "type": "object"
      },
      "type": "array"
    },
    "path_cases": {
      "items": {
        "type": "object"
      },
      "type": "array"
    },
    "version": {
      "const": 1
    }
  },
  "required": [
    "version",
    "lifecycle",
    "commands",
    "path_cases"
  ],
  "type": "object"
}
