{
  "commands": [
    {
      "events": [
        {
          "kind": "started",
          "sequence": 1
        },
        {
          "kind": "stdout",
          "sequence": 2,
          "text": "working\n"
        },
        {
          "exit_code": 0,
          "kind": "completed",
          "sequence": 3
        }
      ],
      "execution_tag": "fixture-exec-1",
      "name": "success_stream",
      "result_manifest": {
        "execution_tag": "fixture-exec-1",
        "exit_code": 0,
        "stderr": "",
        "stdout": "working\n"
      }
    },
    {
      "events": [
        {
          "kind": "transport_disconnected",
          "sequence": 1
        }
      ],
      "execution_tag": "fixture-exec-2",
      "name": "ambiguous_disconnect",
      "recovery": "reconnect and read the terminal result manifest",
      "retry_start_safe": false,
      "start_delivery": "unknown"
    }
  ],
  "lifecycle": [
    {
      "event": "acquired",
      "provider": "e2b",
      "reuse_scope": "persistent_namespace",
      "reused": false,
      "sandbox_id": "fixture-sandbox",
      "template_revision": "fixture-revision",
      "vm_namespace": "user:51"
    },
    {
      "event": "corpus_installed",
      "manifest_written_last": true,
      "revision": 17
    },
    {
      "event": "released",
      "sandbox_retained": true
    }
  ],
  "path_cases": [
    {
      "accepted": true,
      "input": "output/result.json",
      "resolved": "output/result.json"
    },
    {
      "accepted": false,
      "error": "workspace_escape",
      "input": "../secrets"
    },
    {
      "accepted": false,
      "error": "workspace_escape",
      "input": "/etc/passwd"
    }
  ],
  "version": 1
}
